{
  "schema_version": "1.0",
  "trace_id": "TEST-MRG-culture-people",
  "timestamp": "2026-02-25T01:56:39Z",
  "current_approved_pack": "pack0-culture-people@0.0.1",
  "next_expected": "pack1",
  "blocking_reasons": [],
  "history_refs": {
    "approvals_dir": "history/approvals/",
    "run_reports_dir": "history/run_reports/",
    "ocas_dir": "history/ocas/",
    "merge_receipts_dir": "history/merge_receipts/"
  }
}